site,review,month,day,year,rate,sentiment,,,
agoda,Taal Vista Hotel is perfect for families with young kids along with the older family members. I love that they provided free wheelchair to my grandmother the whole duration of our stay. Wide-Open spaces with amazing view of Taal volcano (other side has view of the mountains which is also just as breath-taking).,Apr,18,2015,100,pos,,,
agoda,As always  once you checked in  the last thing on your mind is to check out. Relaxing and comforting.,Apr,16,2015,90,pos,,,
agoda,It was a great stay. My family and I enjoyed the swimming pool  the buffet breakfast. It is accessible . Waling distance to the ranch  the casino and few minutes drives to mahogany market. Staff members are accomodating and helpful. Will definitely stay again in this hotel.,Apr,10,2015,97,pos,,,
agoda,Great!,Apr,08,2015,80,pos,,,
agoda,My wife and I stayed at the Taal Vista over the Easter week end and had a delightful stay. The staff are courteous and friendly  the food was good  and the rooms spacious and comfortable.The hotel itself is quite sprawling so easy to get lost until you know your way around. The view is outstanding  just pray for good weather so you get to enjoy it at it's best. The only negative I will mention is that the rooms were overpriced. Perhaps they were just cashing in on Easter  but we paid roughly double what we would normally pay for a hotel of this standard  Easter weekend notwithstanding. I would rate the hotel as 4 star  not 5 star. But all in all  a very enjoyable weekend.,Apr,06,2015,90,pos,,,
agoda,it was generally pleasant,Apr,06,2015,70,pos,,,
agoda,stay is just average,Apr,05,2015,100,neg,,,
agoda,very comfortable,Apr,05,2015,87,pos,,,
agoda,Its a great vacation  we stayed to celebrate my husband's bday  and its a blast. Very near skyranch.,Apr,05,2015,70,pos,,,
agoda,We checked in at 11pm  only 1 staff was in the front desk. After 10 minutes  he called help fr another who was just inside the room adjacent to the front desk  seemingly chatting with another staff. And for a very nice hotel  the staff seem very lax and would talk loud and laugh loud. I think that's an area of improvement,Apr,04,2015,77,neg,,,
agoda,Very good,Apr,03,2015,100,pos,,,
agoda,Great but the only thing I saw for a five star is some old and very unprofessional repairs to fixtures tiles in the elevator cracked and broken,Apr,03,2015,87,pos,,,
agoda,Very good,Apr,02,2015,73,pos,,,
agoda,Our stay was awesome. we have fun staying on this hotel and we are recommending this hotel other people.,Apr,01,2015,80,pos,,,
agoda,our stay in this hotel was so good. from the reception desk  to room service & the b'fast buffet.,Apr,01,2015,90,pos,,,
agoda,This is the 2nd time we stayed here and we always enjoy staying here because of the location and the music lounge with singer and pianist so relaxing and also the dessert cupcakes and cakes but some staff should trained well in assisting there clients properly but the rest of the staff is OK :),Mar,31,2015,67,pos,,,
agoda,Pretty good,Mar,31,2015,93,pos,,,
agoda,It was great!,Mar,30,2015,80,pos,,,
agoda,The last time I stayed in this hotel was back in the 90's and from what I remember the new management had improved the hotel quite a lot in terms of dining facilities and facilities. I believe some rooms were already renovated  but we were assigned in one of the older wings hence it was obvious that the room (although quite clean) was rundown already and overdue for an upgrade. We had dinner in the hotel but the food was so-so  to think they had an event for visiting chefs. Breakfast was bountiful but nothing really special. Given the price vs. competition in the area  I expected more in general.,Mar,30,2015,87,neg,,,
agoda,Good stay,Mar,30,2015,73,pos,,,
agoda,Kids enjoyed and want to go back,Mar,19,2015,87,pos,,,
agoda,Our stay in Taal vista was good as usual. Although we had a problem with lunch where in when we arrived  the restaurant was all reserved and the only place we went to was the lobby lounge where they didnt serve full meals. However  our stay was great and the rooms were nice. Taal vista will always be one of my favorite places to stay in Tagaytay.,Mar,17,2015,100,pos,,,
agoda,it was amazing. The staff is very helpful & friendly. The breakfast is good. The view & the weather is perfect for celebrating your anniversary.,Mar,17,2015,83,pos,,,
agoda,not sa bad but it could have been better as their price is high,Mar,15,2015,100,neg,,,
agoda,Disappointed,Mar,15,2015,83,neg,,,
agoda,A relaxing one!,Mar,12,2015,50,pos,,,
agoda,it was a very relaxing stay and was able to enjoy it with the family. thank you,Mar,09,2015,100,pos,,,
agoda,We wanted to have 2 rooms with king beds  but one of them with an additional bed. Front desk had to give us 4 different rooms until they accomplished such simple request. Later on  we had to complain because they room with an additional bed had only a bed  but not extra toiletries  slippers  breakfast  etc. In general  it was a pleasant stay  but the front desk clearly could be a much better job understanding the customer requests and checking that everything is done correctly.,Mar,06,2015,80,neg,,,
agoda,Love the food  the views and the staffs...but so costly!!!,Mar,04,2015,70,neg,,,
agoda,Very nice time. Staff is excellent and very attentive. The Sunday lunch buffet/native dancing show was terrific!! Very enjoyable! Would stay here again.,Mar,03,2015,83,pos,,,
agoda,My stay in Taal vista was overall okay. However  Im really disspaointed with their breakfast buffet. The foods are cold  the staffs are not that accomodating.,Feb,25,2015,80,neg,,,
agoda,Quite relaxing,Feb,24,2015,100,pos,,,
agoda,It was a pleasant weekend  a bit rainy but we sure have a long rest away from busy city and with a nice view.,Feb,19,2015,70,pos,,,
agoda,We checked in  and our driver left. We then found out we were staying in a different wing so had to get our driver back. The room was plain and featureless  and it smelled of cigarette smoke. When you compare this with 5 star hotels in Manila  it doesn't match. 4 star  maximum. The menu was very limited. Fairly dull. And they delivered the cold toast in the morning with no butter. Sorry  but that's not 5 star standard. And it was expensive for what it was. We will not be back.,Feb,18,2015,80,neg,,,
agoda,good,Feb,15,2015,73,pos,,,
agoda,Location is good  But anything managed by SM is cheap. Even free items in the room  such as soap and toothbrush you have to call 3-4 times for them to bring. Food very good and low quality. Rooms worth 2000 pesos only. In general what you see at SM you see in this hotel,Feb,14,2015,57,neg,,,
agoda,Very nice,Feb,12,2015,97,pos,,,
agoda,I have been in Tall Vista Hotel many times but mostly for our business conferences. But this time i went (as a couple) in order to relax and just re-ignite. And that we did - being beautiful with the view overlooking Taal Volcano and knowing that its dormant but not extinct. I guess seeing nature in its verdant form gave us also an inner glimpse of our barest souls.,Feb,10,2015,80,pos,,,
agoda,Great,Feb,09,2015,83,pos,,,
agoda,just like last year  we enjoyed our stay in the hotel. staff were nice and accomodating. we always look forward watching the fireworks that even rain poured as we welcome the new year  we enjoyed watching those amazing fireworks even were getting wet due to the rain,Feb,06,2015,100,pos,,,
agoda,great!,Feb,04,2015,97,pos,,,
agoda,it's a beautiful hotel. stayed for a week. you can stay inside the compound if you are there with family. lounge facility is excellent. staffs are very caring and always smiling. best part is the value for money. will go back again if i am in tagaytay.,Feb,04,2015,90,pos,,,
agoda,amazingly superb!,Feb,02,2015,97,pos,,,
agoda,Very disappointing. I dont think it was worth what I paid for it.,Jan,29,2015,53,neg,,,
agoda,our stay is very good. though we only stayed for one night. we should have stayed more if the time permitted  so we can explore more of the amenities. we like the live music at the lounge  very entertaining. Everything is good. we will come back again in this hotel,Jan,28,2015,100,pos,,,
agoda,Excellent   will come back,Jan,27,2015,93,pos,,,
agoda,we had a nice stay there. the view is awesome. the room have a nice balcony and spcious. breakfast not so many choice. i would rate the breakfast not more than 3 star hotel.,Jan,25,2015,77,neg,,,
agoda,It Was good nice room but a bit expensive for the room type.,Jan,24,2015,77,neg,,,
agoda,i enjoyed our stay  i will surely go back,Jan,24,2015,80,pos,,,
agoda,Relaxing,Jan,23,2015,73,pos,,,
agoda,for a five star hotel  our room sink is leaking. This was reported to front desk upon checkout. Traffic during holidays is terrible  avoid going there on long weekends and holidays.,Jan,21,2015,87,neg,,,
agoda,We enjoyed it.,Jan,21,2015,83,pos,,,
agoda,staff very nice... great view... super location,Jan,20,2015,73,pos,,,
agoda,The employees are well oriented and hospitable. Two thumbs up! :),Jan,14,2015,80,pos,,,
agoda,I stayed at the most expensive suite available at the hotel since it is the only one available when I requested for an upgrade. unfortunately  the aircon at the master's bedroom is not working and the staff couldn't do anything on our 3 day stay. they offered some discount on my return as a consolation  that is if I ever go back to this low quality hotel!!!,Jan,14,2015,57,neg,,,
agoda,Excellent,Jan,10,2015,100,pos,,,
agoda,We have a fine stay  although the beds are quite small and the room given to us has no view as it is the outermost room on the mountain wing  its comfort room has no lock and the wooden post in it shows that it is old merely retrofitted. Room 334. Nevertheless  I enjoyed the classical music and wine at the Lobby Lounge which also had a fireplace. We were also able to jog in t3 sky view deck during the early which is eindy & considerably cool.,Jan,08,2015,70,neg,,,
agoda,Overall satisfactory but not great.,Jan,08,2015,67,neg,,,
agoda,The best location and view in Tagaytay. My kids love the walking distance to Skyrach. The food (breakfast) was not for a five star hotel standard and pricey.,Jan,07,2015,63,neg,,,
agoda,Staff and location of the hotel is nice. Our room has no view but the view outside was great. on our room the bathroom was kinda open with a weak exhaust. Kinda expensive imho.,Jan,06,2015,90,neg,,,
agoda,Very pleasant stay.,Jan,05,2015,93,pos,,,
agoda,It was ok basically except for the towels which looks old and worn out,Jan,05,2015,83,neg,,,
agoda,Very disappointing.,Jan,05,2015,57,neg,,,
agoda,Great,Jan,05,2015,100,pos,,,
agoda,Not sa bad but it could have been better as their price is high,Jan,04,2015,80,neg,,,
agoda,Best,Jan,04,2015,80,pos,,,
agoda,our room shower facility was clogged. Informed front desk upon check out  don't know what action was taken.,Jan,03,2015,93,neg,,,
agoda,Food choices so limited and kept on repeating menu  diner staff not alert  tables not prepared well  so long wait for orders,Jan,02,2015,63,neg,,,
agoda,Excellent  we always spent Christmas in this hotel  will come back again !,Dec,29,2014,83,pos,,,
agoda,Quite good,Dec,29,2014,100,pos,,,
agoda,Amazing stay!,Dec,29,2014,70,pos,,,
agoda,Our stay at Taal Vista was very relaxing. The staff are friendly. We'll definitely go back here.,Dec,28,2014,100,pos,,,
agoda,This has been renovated so the rooms are very comfortable and the restaurant is cozy. It is centrally located and has a nice pool and a very large garden. The views are perfect for picture-taking.,Dec,28,2014,80,pos,,,
agoda,Best hotel stay in my short trip in Philippines,Dec,26,2014,93,pos,,,
agoda,Very nice,Dec,26,2014,73,pos,,,
agoda,Warm  comfortable and a welcoming retreat from the busy city life.,Dec,25,2014,77,pos,,,
agoda,It's was pleasant but breakfast of 3 star,Dec,25,2014,77,neg,,,
agoda,Superb.,Dec,24,2014,100,pos,,,
agoda,If you are coming to Tagaytay for the view - this is the perfect place. The lake is stunning  and the view from the deck is amazing of the volcano and surrounding area. The hotel is right next to an amusement park - a bit of a wild place  but fun for the family. The hotel has a beautiful lobby and bar area  and the pool is cute and nice. Our room had dirty floors  the tub was not great  mirrors had not been cleaned in a long time  and overall  not 5 stay quality. The lobby is 5 star while the room is much closer to a 2 star room. Our dinner was pretty bad and while we did enjoy most of the breakfast food  the plates and trays at the buffet were often empty for long periods of time. The dining room was chaos during breakfast - more staff and more efficient staff are needed. My advice would be to find a small hotel in the area and get a more intimate experience and skip the Taal Vista.,Dec,23,2014,60,neg,,,
agoda,it was fun,Dec,23,2014,70,pos,,,
agoda,We had fun! A must try!,Dec,22,2014,83,pos,,,
agoda,GReat experience!,Dec,21,2014,90,pos,,,
agoda,Great taal lake view,Dec,19,2014,93,pos,,,
agoda,The stay was very satisfying. There were occasions though when other guests tend to forget that there were other guests staying in the hotel. Our first night was almost a fiasco with guests staying right above our room constantly trampling around their room. This was remedied though with prompt response to our request for change of room. In the new room though  defects continued to hound us with a dripping aircondition and a safe with weak batteries. The response to these complaints were prompt and remedies done were satisfactory. Then on our penultimate day  cleaning was haphazardly done with coffee mugs left unwashed and floor left improperly mopped.,Dec,18,2014,80,neg,,,
agoda,The deluxe rooms have ceramic floor tiles that give it a cheap feel. Toilet furnishings are minimal and budget hotel standard  but they price themselves 5 stars. Breakfast buffet spread limited  and the staff are too busy to clear tables to provide service standards expected from a 5 star hotel. Kids play room is a pathetic little room with minimal toys or books. Nothing here is near 4 star let alone 5 stars,Dec,18,2014,80,neg,,,
agoda,Had a lovely  will definitely return,Dec,14,2014,87,pos,,,
agoda,The location and view from the premier lake room can't be beat. Staff is very courteous and friendly. Spa is good though expensive. However  condition  cleanliness and food choices need to be upgraded.,Dec,14,2014,80,neg,,,
agoda,Everything is just perfect! From the rooms to the food up to the staff! Definitely going back! Cheers Taal Vista! :),Dec,13,2014,100,pos,,,
agoda,Excellent! Would definitely come back.,Dec,11,2014,100,pos,,,
agoda,Although they rate themselves as 5 star we feel they are overrating themselves knowing that most of their facilities are outdated. The price is too high for everything they offer.,Dec,11,2014,100,neg,,,
agoda,Excellent,Dec,09,2014,83,pos,,,
agoda,The staff is great they are very friendly and very hospitable. We have also tried the spa which I recomend. We had I good experience with it. Plus the food is another great experience. Overall I recommend this hotel.,Dec,08,2014,100,pos,,,
agoda,average and was disappointed as our first day and at 7am was woken-up by a loud music playing outside garden with no consiseration to their guests still asleep. Complained to the front desk but nothing happened not even apology.. Overall will not stay again,Dec,05,2014,37,neg,,,
agoda,"Taal Vista is a hotel with a lot of history. The location is unique and the pictures and history are fascinating to read. The view is brilliant, but you do not have to stay in the hotel. Our room was upgraded room had noppes view, and work going on. The pool is a swimming pool, nothing special. Breakfast is a habit. The lobby is stylish and classic. Beautiful view for coffee with piece of cake. The complete massage in the spa was very nice. It smelled a bit muffy in the room, but in the evening it's lovely to sit outside in the coolness. But that can be anywhere else too. Personally, I would like to have a drink or a drink with a view of Language Volcano. Overnight stays can be better done for the money. But for a night it was good to do it. There are many conferences and meetings in the hotel VAT.",Dec,04,2014,70,pos,,,
agoda,The room we got is old and a long walk from the lobby  restaurant  and parking area! Walk  walk  walk!,Dec,04,2014,80,neg,,,
agoda,it was ok  what was disappointing though was that i booked two rooms and we were assigned to 2 different floors. front office management should anticipate the needs of families.,Dec,02,2014,80,neg,,,
agoda,Comfortable and relaxed,Dec,02,2014,73,pos,,,
agoda,The room was spacious and comfortable. I would have wished that the door would offer more privacy since i can hear footsteps and noise coming from the corridor. Also  pls install bidet in all your water closets. Much thanks for the warm service.,Dec,01,2014,100,neg,,,
agoda,I expected too high  so was disappointed. Staff not very efficient. Food was too sweet for my taste. Does not seem to be worth the money.,Nov,29,2014,83,neg,,,
agoda,Nice and relaxing. The food is also good and they provide a lot of choices.,Nov,27,2014,67,pos,,,
agoda,Nice hotel with a great view. The only problem was that we were locked out of our room and I had to walk all the way to the front desk to have the key reset.,Nov,26,2014,100,pos,,,
agoda,good view  friendly staff  near entertainment areas,Nov,24,2014,87,pos,,,
agoda,We love the hotel  the staff  the food and the location. We will definitely stay here again,Nov,24,2014,90,pos,,,
agoda,Lovely  cool stay at the Batangas suite and premier rooms for our family of 6. Parking was big and generous  same as lobby and sitting areas. Reception  porter and waiters were so attentive to our needs. Even at the breakfast room  plates were cleared swiftly. The simple furnishings of the place does not overshadow the hotel's biggest selling point  the VIEW. No amount of expensive or grand adornment can rival what it naturally has. Just one minor suggestion  we hope reception guides where to park depending on room location considering its such a long building and has 2 lobbies and underground parking. People with walking problems have to alight near their rooms.,Nov,23,2014,90,pos,,,
agoda,Short but pleasant stay at the hotel. The airconditioning unit could use some improvement though and the luggage service took a while as we were checking out but the very helpful bellboy made up for it anyway.,Nov,22,2014,97,pos,,,
agoda,We stayed in an old wing. Far from lobby. Main complaint was that walls were paper thin. Could here the people in the room next to me watching TV at 1am!,Nov,20,2014,67,neg,,,
agoda,I love it and will def come again!,Nov,20,2014,97,pos,,,
agoda,Had they not found an early 8a.m available room we would have gone elsewhere despite our room prepayment. Service is slow.,Nov,18,2014,100,neg,,,
agoda,Terrific,Nov,18,2014,57,pos,,,
agoda,Nice staff  good food. Good to be here.,Nov,16,2014,87,pos,,,
agoda,Had a great time and even when the hotel was crowded with events  they make it a point to find parking for hotel guests. It was beside the SkyRanch so we just walked over and had a fun weekend...,Nov,10,2014,100,pos,,,
agoda,Awesome. Great food. The kids enjoyed the place. Awesome!!!,Nov,10,2014,90,pos,,,
agoda,Had a good stay but this hotel is in need of an upgrade. Our room had a gross stain on the main light shade in the room. I had to cover it with a towel so I didnt have to see it while in the room. Breakfast is just ok. Many of the hot items are not so hot. Nobody likes cold waffles  pancakes  or bacon. I found it odd that the toilet had no spray washer for all the local filipinos. Maybe a little overpriced.,Nov,07,2014,53,neg,,,
agoda,We tried the promo online that's why we got the Mountain View room. We didn't expect it to be that old and it seems that it was not well-maintained. The bathroom looks old and the smell was not so good. We also didn't like the furnishings. It's like we're not in Taal Vista at all.,Nov,07,2014,60,neg,,,
agoda,Had a good stay but this hotel is in need of an upgrade. Our room had a gross stain on the main light shade in the room. I had to cover it with a towel so I didnt have to see it while in the room. Breakfast is just ok. Many of the hot items are not so hot. Nobody likes cold waffles  pancakes  or bacon. I found it odd that the toilet had no spray washer for all the local filipinos. Maybe a little overpriced.,Nov,07,2014,53,neg,,,
agoda,We tried the promo online that's why we got the Mountain View room. We didn't expect it to be that old and it seems that it was not well-maintained. The bathroom looks old and the smell was not so good. We also didn't like the furnishings. It's like we're not in Taal Vista at all.,Nov,07,2014,60,neg,,,
agoda,I like it. Hopefully will come Bach soonest,Nov,06,2014,77,pos,,,
agoda,Great experience! Stayed in a premier room  i suggest that mgt. trim the tall trees since it obstructed our view from the 3rd floor.,Nov,06,2014,87,pos,,,
agoda,The room we got was at the old building. Not satisfied with the room  bathroom looks filthy. They need to renovate asap.,Nov,06,2014,67,neg,,,
agoda,the stay was pleasant  was able to re-charge from a very busy week.,Nov,06,2014,67,pos,,,
agoda,I like it. Hopefully will come Bach soonest,Nov,06,2014,77,pos,,,
agoda,Great experience! Stayed in a premier room  i suggest that mgt. trim the tall trees since it obstructed our view from the 3rd floor.,Nov,06,2014,87,pos,,,
agoda,The room we got was at the old building. Not satisfied with the room  bathroom looks filthy. They need to renovate asap.,Nov,06,2014,67,neg,,,
agoda,the stay was pleasant  was able to re-charge from a very busy week.,Nov,06,2014,67,pos,,,
agoda,we had so much fun  enjoy the view and the friendly staff are great.,Nov,05,2014,60,pos,,,
agoda,we had so much fun  enjoy the view and the friendly staff are great.,Nov,05,2014,60,neg,,,
agoda,overall stay was ok although rooms were a bit rusty... we appreciate their effort in giving us adjoining rooms since we were with our kids...,Nov,03,2014,100,pos,,,
agoda,overall stay was ok although rooms were a bit rusty... we appreciate their effort in giving us adjoining rooms since we were with our kids...,Nov,03,2014,100,pos,,,
agoda,My husband and I stay in Taal Vista at least once per quarter. The staff are great. And overall experience is satisfactory.,Nov,02,2014,80,pos,,,
agoda,Fair,Nov,01,2014,87,pos,,,
agoda,I am requesting a refund from the manager. For two nights we have stayed we have experienced noise coming from the ceiling which we believe that was caused by rats. But since I purchased the booking from agoda they said cant refund  and would take by 4 weeks to process from agoda. It is a bad experience waste of time  could have spent it somewhere else.,Oct,31,2014,47,neg,,,
agoda,It was okay  i didnt like the fact that the hotel lobby was full of people attending various events happening at the same time - weddings  sales conventiom  etc.,Oct,29,2014,57,neg,,,
agoda,Sulit ang presyo!,Oct,26,2014,93,pos,,,
agoda,The hotel is just located beside the Taal lake and have great view. The room is spacious and comfortable. The staff are very friendly. There is also a casino opposite the hotel if you want to try your luck.,Oct,26,2014,80,pos,,,
agoda,very nice environment,Oct,24,2014,100,pos,,,
agoda,It was a great stay there and the view was so attractive and cooling,Oct,23,2014,87,pos,,,
agoda,everything was ok..except for the beds !! their to hard not comfortable for sleeping,Oct,23,2014,90,neg,,,
agoda,Ive been to taal vista several times and it is our only choice of hotel to stay in tagaytay because of its ambiance and very relaxing surroundings. Perfect place if you want to get out of the city and have a breathe of fresh air,Oct,22,2014,97,pos,,,
agoda,It was great! Our kids had so much fun.,Oct,18,2014,83,pos,,,
agoda,Very good stay  travel arrangements perfect  pool water was very cold. Breakfast was very good  staff cute and friendly  we would stay there again  restaurant staff arranged a perfect engagement dinner  thank you,Oct,17,2014,97,pos,,,
agoda,Best part is the view. Hotel is located at the top of the road down to the Taal Boat ride docks and beaches  bisects the main road that connects all life in Tagaytay. Close enough  but also far enough away from the crowds at Summit Ridge and the second roundabout. Buffet breakfast was good  but room is crowded/noisy when busy. Dinner on Friday nights is expensive but best in town. Rooms remodeled still have a classic feel  though the remodeling is still ongoing. Covered walkway connecting the main building and the mountain wing is gone  so when it rains  one cannot walk without an umbrella even within the hotel. Example: walking to dinner or wedding - going to get a little bit wet unless you have an umbrella  and you will have to carry the umbrella around with you - no umbrella stand. In the room: no clothes hangers on closet left side makes it unusable. No robes in room  just slippers. Noise passes easily through the adjacent room doors; easily fixed with some soundproofing. Passed these notes to the GM  and we will see on our next stay at Taal Vista next year.,Oct,14,2014,93,neg,,,
agoda,it was good.. room is so big for couple,Oct,11,2014,60,pos,,,
agoda,It was quite good.,Oct,10,2014,90,pos,,,
agoda,In general  the stay was superb. The room was very clean  has free and strong wifi and big. Staff was very polite and helpful and the location of the hotel is perfect. However  the breakfast buffet was not very good  its too expensive considering the food selection and taste.,Oct,09,2014,93,pos,,,
agoda,great. pool closed too early,Oct,08,2014,87,pos,,,
agoda,Fair,Oct,08,2014,77,pos,,,
agoda,Relax to the max,Oct,08,2014,93,pos,,,
