site,review,month,day,year,rate,sentiment,,,
agoda,Room was for 2 but they were able to prepare the extra bed before we checked in. The problem with the mountain wing was it was too far from everything: reception/lobby area and the breakfast buffet. Compared to the other rooms  you can see that the room was already old. And the extra bed they gave us broke but we didnt bother to report it because we just stayed for a night.,Feb,01,2013,83,,,,
agoda,It was a romantic night for me with a cool breeze felt while walking ..the staff were very accomodating.. The room was ok.. One thing I notice the door of my room was quite hard to open.. I need to pull down hardly.. The food was great especially the sizzling bulalo.. The best!!!,Jan,31,2013,73,,,,
agoda,Over all good hotel. Older but well maintained and great location.,Jan,30,2013,73,,,,
agoda,I enjoyed staying and will come back and refer to my friends,Jan,30,2013,100,,,,
agoda,I stay 2 days there. It's a nice hotel  best situation in Tagaytay and beautifull view on Lake. Unfortunatly  service is not in relation with hotel rate and personal expectation.,Jan,27,2013,53,,,,
agoda,Stayed for a day. Got a room in Lake Wing assuming it will have a view of the lake  but was overlooking concrete roof tops of other building. Eventually moved to another room paying 1000 PHP extra to get lake view. SO Lake Wing is not same as Lake View A bit noisy at the lobby and restaurants due to business being good for the Hotel. Other than that a good place to spend a couple of days while vacationing in Tagay Tay,Jan,24,2013,87,,,,
agoda,Booked on Agoda then upgraded to a room in the new Wing with a balcony for PhP 1500 extra per night  well worth the extra money! Room was very clean  had a beautiful view of the lake and Taal volcano. Hotel staff was very accommodating. Checked on booking a tour to the volcano with the hotel and they quoted me PhP 5800 (equal to about $140) for 2 people (car ride down to lake  boat ride out to volcano and horses and guide)  my Filipina friend negotiated with one of the locals outside McDonalds (directly across from the hotel and next to PAGCOR Casino)  for PhP 2900 (or about $70) for 2. Only difference was ride down was in a Tricycle  which I think was probably better.,Jan,21,2013,90,,,,
agoda,The hotel is great! The hotel gives you a great view of Taal volcano and the surrounding lake outside the rooms that are not suites. The suites offer the great Taal lake views from the windows. The hotel is near restaurants such as Lesley's Firelake Grill and Antonio's. It's also near native coffee shops like Bag O beans and Cafe Breton. Overall  it's a great experience loding at the hotel.,Jan,19,2013,100,,,,
agoda,a very well located hotel though a little far from taal volcano. there is not much to do in the surroundings but there is not too much need to go outside. the hotel provide all your needs.,Jan,18,2013,100,,,,
agoda,We were given complimentary upgrade when we arrived in the hotel. Our 3 yr old son had so much fun  there's playroom area and nice view from the hotel.,Jan,18,2013,77,,,,
agoda,we had to wait for our room to be ready when in fact we had checked in late. not too sure why there was a wait time  since it was a sunday adternoon and the hotel was not fully booked.,Jan,17,2013,67,,,,
agoda,get a deluxe or premiere room that lets you enjoy the exhilarating view of taal lake. if you want to fully enjoy a restful  serene weekend  choose taal vista. i specially would like to commend the front desk staff who accommodated my request to be upgraded from a non-view room to a room with the lake view without extra cost. i just told her i'm in tagaytay because a have to do some biz planning and i need the serenity of the lake to be able to read and plan well. true enough  after all guests have checked in since there was an available room that i requested  she upgraded my booking with no extra charge.,Jan,17,2013,93,,,,
agoda,This hotel is located with a good view of the Taal Lake and Taal vulcano. The staff are polite and helpful with arranging trips to Taal volcano and other.. The location is slightly high up  wich you will notice by it being a little more cold in the temperature  but for a norwegian still pretty warm. Asian were obsevated with jackeds though.. As we were tree friend travelling it was though abit quiet for us during evening and night time  and the nearby casino was not exactly our taste (a bling-bling-tacky one full of cigarette-smoke)  but fun to see. So I would recommend this place mostly to families and pares not looking for a party nightlife. It might also be abit expancive comered to other hotels nearby. We stayed two nights before we travelled on.,Jan,15,2013,90,,,,
agoda,the hotel is very relaxing and comfortable. we had a great time and the location is very accessible. additional bonus is the proximity of the casino!,Jan,14,2013,90,,,,
agoda,The rooms has been updated and renovated  in our previous stay the bed squeak and was uncomfortable to sleep  but now the facilities has been fully upgraded  new tiles  new bed   new bathroom and fixtures Except would like hotel to provide better hotel sandals   no razor blade provided in the bathroom,Jan,13,2013,77,,,,
agoda,From the entrance of the hotel the staffs are very respectful and accommodating. The front desk staffs are cordial and helpful. The features of the room is what we expected it to be though we didn't get the room with the view of the garden and Taal Volcano. The restaurants are very lovely  providing a full view of the garden and Taal volcano. The food is excellent but the number of staffs are few so service took awhile. the three man band is an added feature of the restaurant that provided a special delight to the guests.,Jan,12,2013,77,,,,
agoda,The front desk staffs were very cordial and helpful. So glad they did not give us a hard time. The room is sufficiently big for our older kids. The restaurant has the beautiful view of Taal and it adds to the overall delightful experience. The food was excellent though the staffs were few therefore took a long time to assist us. One very helpful feature of the hotel is the Kultura store where one can buy canvass bags and jackets.,Jan,12,2013,73,,,,
agoda,everything went well except when we checked out  apparently a couch had an old burn that we overlooked. they tried to charge us for this which was unsettling and disconcerting. Was this a scam that they pulled on guests because they use this service?,Jan,12,2013,57,,,,
agoda,very nice hotel  luxurious feel... staff very attentive and courteous... i very much enjoyed my stay here.....the grounds are well maintained the views  awesome. close enough to local eateries and attractions... though many times we caught a trike  (a small motorbike with a side car very popular mode of transport in the pi... though a bit tough to get in and out if your a bigger sized foreigner).. they can be found outside the hotel grounds in front of mcdonalds). should cost you no more than 30 pesos for small nearby trips. i don't gamble but there is a nearby casino located within a 5-10 minute walk. buffet breakfast was excellent... drinks were a little pricey... i have two slightly negative comments... one is super small... at night in the lounge area there was an instrumental entertainer and it would have been nice if the volume of his sound system had been turned down by 50-60% to create a soft dinner drink atmosphere... i really love the filipino people and have great respect for them... very friendly and warm but when it comes to music  they seem to enjoy one volume.. loud... the second is that this hotel is very popular and thus a bit noisy... large groups  families  functions  etc   so if you are looking for a quiet  little hideaway  this hotel might not be the ideal one for you.. all and all an excellent stay...,Jan,11,2013,87,,,,
agoda,We visited Tagaytay for a wedding. The Taal Vista is a lovely hotel with stunning views. Our room was very clean. We used the express laundry service (as no iron in the room) and had our cloths back within 1 hour. Staff are very friendly and happy to help out however they can. I didn't think the food was very good  but I think that's pretty normal for anywhere in the Philippines.,Jan,09,2013,80,,,,
agoda,Been staying at taal vista ever since they opened. Great view  relaxing rooms and very convenient location. Just the best in tagaytay.,Jan,09,2013,100,,,,
agoda,The location is fantastic. Staff greet you with warm smiles. We love the Taal lake view at the back of the hotel. The ambiance is great. We enjoyed the facial massage in the Spa center. The food is a bit pricey but good. We're not especially fond of the bathroom. But the room is okay. Overall we love our stay in the hotel.,Jan,09,2013,70,,,,
agoda,This is my first time to stay here in Taal Vista and i give it a 2-thumbs up! The location is the best since me and my mom can appreciate the view of Taal lake. It was just breathe-taking. Parking wasn't a problem since they have a lot. We stayed in the new wing of the hotel so everything looks and smells good. The only down thing with Taal Vista is their buffet which offers limited food. It is still best to eat outside the hotel. Overall  I am definitely coming back to stay for a couple of nights here.,Jan,09,2013,33,,,,
agoda,You need to upgrade the room if you booked through agoda to have a nice view in your room  Good thing they have wifi in the room  the restaurant is expensive,Jan,08,2013,73,,,,
agoda,The staff are attentive and considerate. Food is great. The best part of it is the wonderful scenery of the lake and the cool  relaxing weather. I'd go back,Jan,08,2013,77,,,,
agoda,The beautiful  picture-like scenery of the volcano is on your window. Nice place to have a peaceful vacation. I had my first night on agoda rate then extended one more night. My second night was even cheaper than agoda rate because of their promo. Better check their promos first before booking. Staffs were friendly especially FO agents. For f&b very slow. Almost ruined my trip but got better with sincere apology from the management. Bathroom is a bit small compared to the size of the room but tolerable. I think they also have a connecting room good for family. Foods are also nice.,Jan,08,2013,77,,,,
agoda,everything was good.. picturesque view  good buffet. i have reserved a superior mountain wing room for me and my husband. the room was gloomy looking and we had to walk through a loooong hallway to get to our room. Everything else was good..,Jan,06,2013,87,,,,
agoda,I would highly recomend the hotel for people who love to stay away from home fm time to time a bit costly but worth it.,Jan,05,2013,87,,,,
agoda,i did not get what i paid  i am expecting a lake view from the room but the room we got does not have a view at all. another thing is we are on the first floor and you can hear walking on the second floor. i am disapponited!,Jan,04,2013,40,,,,
agoda,We always stay in Taal Vista in December before Christmas. We enjoyed our stay but wished the food was as good as the past years. This year's dinner buffet is markedly inferior to previous years. The dimsum was cold  the paella was just colored rice. Nothing had great flavor. If Taal Vista does not imporve buffet  best to stay at Taal Vista and then eat out,Jan,02,2013,73,,,,
agoda,it is well worth the money spend. ideal for not-too-far-away from the main city vacation!,Jan,01,2013,87,,,,
agoda,This hotel is the premier destination in Tagaytay. The room are new and well appointed. The very nice lobby and lounge surely captivates the visitors. You can just stay in the hotel and savor the fine details of the interiors and the decors. The staff are always smiling and accommodating.,Jan,01,2013,100,,,,
agoda,the place is relaxing and just the right hotel to stay in when you want to get away from the noise of manila. tagaytay has developed a lot and there are many places for foodies to go to. the view of taal volcano is just amazing in the early morning.,Jan,01,2013,90,,,,
agoda,Checking in was easy but it wasn't warm welcome . I guess I was local so They weren't as friendly as to foreign guests  what a shame. They also Didn't tell me how to get to my room etc  I had to ask. Now here's the odd part  got in my room started to unpack And I heard Someone went in and took a piss in the bathroom. I yelled hello and it was a male housekeeper who Said sorry and was going to clean the bathroom. To Think of it shouldn't be cleaned already since it was ready To be occupied? Checked the bathroom and it was not as what you expect from A 4 star hotel. It was a bit dingy and there's a filthy ring around the Toilet. There was no alarm clock  sign for the complimentary drinks Etc. Food was ok  but steep. Overall this place fell short. I just hope they should treat All guest equal since we're all from the same country. Geez!,Dec,31,2012,60,,,,
agoda,During our stay the hotel was partially under renovation and it caused some noise and changes to lobby functions. Anyway the renovation should be already done at this time. Food on the menu is quite affordable for an exclusive hotel like this one  but it lacks of international dishes as there is only 5 listed if I remember correctly.,Dec,29,2012,93,,,,
agoda,it was our first time to stay in this hotel and all i can say is this hotel really deserve to be ranked first among the hotels in tagaytay. every cent is worth it. from the facade doown to the hotel staffs. my husband and i enjoyed our quiet and bonding moment while our five yr old son enjoyed the cool breeze and.view of taal in the hotel garden. also  our son enjoyed the small but colorful child-friendly playroom. their food was also good. we enjoyed the breakfast selection and the christmas eve dinner selection. food not to pricy also. lounge area is cozy and we had the christmas feel while listening to the chorale singing selected christmas song. thumbs up to taal vista hotel. we will definitely come back.,Dec,29,2012,97,,,,
agoda,It's always a pleasure staying in this hotel. we are on the third consecutive year of celebrating Christmas because of its nice weather and great view of the world's smallest volcano  Taal Volcano. The staff are very accomodating which is the main reason why we always come back in this hotel.,Dec,28,2012,93,,,,
agoda,I stayed here for 3 days and two nights yet  they have good and clean services. Rooms were enough with full functionality.,Dec,28,2012,83,,,,
agoda,very nice hotel in tagaytay very close to most of the good places to visit. staff is helpful and nice but the booking has no breakfast with it. entrance to hotel is a bit confusing because the lobby where you check in is far from where your actual room is. there is a lot of people/foot traffic going through the hotel so it makes you feel not so secure.,Dec,27,2012,70,,,,
agoda,The rooms are acceptable for me since we came for Tagaytay not the hotel itself. It would be better if the rooms were carpeted  good thing the room was wide enough for us (3 adults 1 toddler). I was really surprised that the bathroom doesn't have a door or a divider for privacy purposes. So when someone is taking a shower or doing the #2 in the bathroom  it's really exposed to everyone in the room. Maybe for some it's fine  but for me I want to have privacy in the bathroom. Aside from that  the room has a flat screen TV  air-conditioning was fine and a poor wifi signal. Overall my stay was great  we didn't really enjoy the amenities since we didn't have time for it.,Dec,26,2012,83,,,,
agoda,We were happy to learn that our room was ready ahead of schedule and we were given an upgrade to a room with a balcony and view of Taal Lake and Volcano. It was awesome. The staff in the front desk was accommodating and smiling all the time. The guards were respectful. Aside from the restaurant in the hotel there are a lot of food outlets in the strip of various international cuisine.,Dec,24,2012,80,,,,
agoda,Has a very great view of the volcano. Staffs were very friendly and accommodating. The hotel was accessible to the attractions just across to mc Donald's and to the casino. Highly recommended to travelers with big family.,Dec,24,2012,97,,,,
agoda,- Professional and hospitable service crew - Hotel premises neat  well kept and elegant - Convenient parking provisions for guests - Top notch room amenities perfect for couples or families with 2 children,Dec,22,2012,100,,,,
agoda,We were suppose to be booked in a premier room  on the 4th floor  but instead got the third floor. I didn't get a very good view but it was still nice. The hotel clerks just seemed to want to book our car although they should have told us that we can only stay on top of Taal for a little while due to it being so late. The extended stay for the car seemed extreme. If you're late a half hour  they charge you a whole hour. No time souvenir shopping or anything else  but a quick look at Taal.,Dec,21,2012,63,,,,
agoda,Deluxe lake wing implies that we will be occupying a room with a view of the taal lake. Although it was made clear in the promo details that our view was garden view  I didn't expect our view to be facing the main road. Worse  it was exactly facing Pagcor's hideous colorful facade. I also chose to stay in this hotel because I expected that it would have a freezer in the ref  as I needed to pump breastmilk. Much to my dismay  there was no freezer inside the ref. Furthermore  the housekeeping guys kept on knocking on our doors  disturbing our sleep and private time asking if we need anything but when I asked for chest w Ice i was given a flat No by the housekeeper. Didnt even try. It was as if he was expecting we didnt need anything. Worst of all  i found out that Taal Vista was offering 50% off just days before our stay.,Dec,20,2012,80,,,,
agoda,A great two night stay at the beginning of our trip started well with an early check in (7am in fact ) with no extra charge. The location and the grounds - lovely lawn dand balcony overlooking the lake and volcano - are definitely the selling point of this hotel. Went room only and although pricey  we were well looked after and really able to relax. Ate dinner at the restaurant which was okay  used the gym - small but a fair bit of equipment  however too cold to go in the pool and didn't take up their overpriced tours or transport. The staff were very helpful once they realised we didn't want to pay for tours but do it independently. The shower was needin attention  hot water but pressure and focus bad  flooded a little and the room could have had better heating rather than ac - minor points compared to the positives....would return again if we were back in the area.,Dec,20,2012,87,,,,
agoda,Did not quite enjoy our stay due to the room given was not really prepared when we checked-in. The light did not turn on when we put the key in the slot  the bathroom gets flooded and the TV in one of the rooms was not operational mainly because upon checking the remote battery was wrongly put. The main concern is the bathroom. The expectation of being a five star hotel was disappointing. We paid the right amount  we expected the right service.,Dec,19,2012,63,,,,
agoda,This hotel is good value but very small old style New York rooms. It feels very cramped very soon. Quite lesser standard than othr Best Western Hotels in USA (as expected becasue it is in NY). But very good location close to all the action.,Dec,18,2012,67,,,,
agoda,Let me clear the matter up first... I bought from Agoda a deluxe room on the lake wing. This is a bit misleading because of the terminology used by the hotel. A deluxe room is like a budget room WITHOUT a view. To get the view to die for you need to upgrade ( which i was thankful for .. i paid 25 USD equivalent to go to PREMIERE Lake view). I waited for 30m but it was so worth it - the room is larger and the view from the balcony is the absolute greatest you can get at Tagaytay. There is no breakfast but who cares... you can get breakfast from a Maccers just across the road  the location is convenient that you are within distance to all the restos granted you have a car. Inside and outside the hotel is like night and day. Outside  third world - Inside  First world. Try it out and you will see what i mean. Just goes to show what a beautiful place Tagaytay could be if managed properly which is a testament to how well this hotel is managed. Enjoyed my stay definitely coming back.,Dec,18,2012,97,,,,
agoda,We had a great time in this hotel and excellent service... The place is so relaxing and have a very good ambiance.,Dec,18,2012,93,,,,
agoda,Excellent hotel with grerat staff  great food and great view!,Dec,16,2012,100,,,,
agoda,I was hesitant at first because of what I remembered about Taal Vista. But I was surprised that it's now fully renovated and refurbished! SM did a good job at it! The front desk was very helpful and the amenities were complete. Parking's a bit of a problem when there's an event but otherwise  a great stay!,Dec,12,2012,90,,,,
agoda,The room was good  though said it was overlooking the lake  our room was not so. It can only view a bit of the lake but we can mainly see the construction on the next lot. Other than that the experience was great,Dec,12,2012,77,,,,
agoda,It was raining most of the time  so there was no view of Taal except for about half an hour.. but if the weather is nice  the view is amazing. Not all of the rooms have a view of the lake. But you can always walk out to the viewing area near the lobby. The lobby is nice and there is usually some relaxing music or entertainment going on at night.. The spa is very nice  but it was a VERY far walk from our room. By the time I got back to my room I needed another foot massage I believe they are currently renovating the rooms closer to the spa. It is better to have your own car  as most of the attractions and restaurants are a little far away. The security is very good here  but almost too good. For example they required us to walk out to the lobby to meet the McDonald's delivery ourselves. They would not allow him to deliver to the room  so that was an inconvenient surprise. Overall the staff is very professional  and property is nice  and they are busy with renovating a large part of it  so it should be even better soon. I would consider this a good place for business or convention stays. Best for couples or groups of adults  not the best for families with small kids.,Dec,10,2012,73,,,,
agoda,This hotel has a wonderful view of Taal volcano. They have excellent staff who attend to your needs.,Dec,10,2012,97,,,,
agoda,the view of the surrounding was expectacular  everywhere you go. there is a nice place to stay  sit back or just relax  enjoy the cold weather. treat yourself to the great buffet. even the breakfast is superb! at night you can hang out in diffrent places. one is distillery where you can drink alchoholic beverages.,Dec,05,2012,100,,,,
agoda,We had an incredible stay in Taal Vista Hotel. looking forward to our next visit to the place.,Dec,04,2012,100,,,,
agoda,We were booked at the superior room/mountain wing but was supposedly upgraded to lakeside. The reason given by the front desk person was that the mountain wing rooms were fully booked. Since it was free of charge  we were happy about the upgrade  initially. I have stayed at the mountain wing rooms with my family and I would say that I still prefer that wing. It was nearer the pool where we could just lounge after a dip. In the first place  the view from our room was a construction of a building. Secondly  since there were two wedding celebrations  the floor was almost always noisy because the rooms in our floor were mostly occupied by the entourage in the wedding.Next time  we would insist on getting a room at the mountain wing since that was what we have reserved for.They have just been newly refurbished  anyway. And  our room did not have a sofa bed,Dec,04,2012,87,,,,
agoda,We spent a weekend with two other couples and we had a fantastic stay. We stayed in the new Wing where the air condition works much better than in the old building. Some of us had a view of the volcano from the room and it is worth paying a bit extra to wake up to this breathtaking view. We had an afternoon dip in the nicely chilled pool  it was really refreshing. The evening buffet at the hotel was a bit disappointing and was not what it used to be when we first time visited Taal Vista Hotel some years back.,Dec,01,2012,80,,,,
agoda,we always go to taal vista every year. i like the spaciousness of the room.,Nov,29,2012,93,,,,
agoda,This is the hotel to stay if you don't want to go out to other places in Tagaytay. By just staying inside the hotel will already make you relax.,Nov,28,2012,90,,,,
agoda,Very enjoyable weekend stay  everything was as it should be  service  staff and food was top notch,Nov,28,2012,100,,,,
agoda,We booked this hotel room as part of our wedding party. Every one person in their staff was more than attentive (even if they did not know that we're part of the wedding party) to our every need. There was always someone to assist me in bringing in luggage and stuff up to my room. I recommend Taal Vista because of its excellent service and good food for their functions. Breakfast buffet food is just okay but I've had lunch there also on another occasion and it's good.,Nov,24,2012,90,,,,
agoda,We enjoyed our stay.the place was clean  the staff were accommodating and very friendly. Surely  we will stay there again.,Nov,23,2012,80,,,,
agoda,We had a great stay at Taal Vista Hotel.My family enjoyed a lot and hope to come back again.To the staff  keep up the good work.,Nov,23,2012,83,,,,
agoda,I feel relaxed and wanted to go back again! The view are great and the service and you get a warmth welcome from the staff! Highly recommended!,Nov,15,2012,90,,,,
